{
  "families": {
    "bench_press": {
      "aliases": [
        "bench press"
      ],
      "familyId": "bench_press",
      "name": "Bench Press"
    },
    "biceps_curl": {
      "aliases": [
        "barbell curl"
      ],
      "familyId": "biceps_curl",
      "name": "Biceps Curl"
    },
    "calf_raise": {
      "aliases": [],
      "familyId": "calf_raise",
      "name": "Calf Raise"
    },
    "chest_fly": {
      "aliases": [
        "flye",
        "flyes"
      ],
      "familyId": "chest_fly",
      "name": "Chest Fly"
    },
    "chin_up": {
      "aliases": [
        "chinup",
        "chin up"
      ],
      "familyId": "chin_up",
      "name": "Chin-Up"
    },
    "deadlift": {
      "aliases": [],
      "familyId": "deadlift",
      "name": "Deadlift"
    },
    "glute_bridge": {
      "aliases": [],
      "familyId": "glute_bridge",
      "name": "Glute Bridge"
    },
    "hip_thrust": {
      "aliases": [],
      "familyId": "hip_thrust",
      "name": "Hip Thrust"
    },
    "leg_extension": {
      "aliases": [],
      "familyId": "leg_extension",
      "name": "Leg Extension"
    },
    "leg_press": {
      "aliases": [],
      "familyId": "leg_press",
      "name": "Leg Press"
    },
    "pull_up": {
      "aliases": [
        "pullup",
        "pull up"
      ],
      "familyId": "pull_up",
      "name": "Pull-Up"
    },
    "romanian_deadlift": {
      "aliases": [
        "RDL"
      ],
      "familyId": "romanian_deadlift",
      "name": "Romanian Deadlift"
    },
    "row": {
      "aliases": [],
      "familyId": "row",
      "name": "Row"
    },
    "shoulder_press": {
      "aliases": [
        "overhead press",
        "military press"
      ],
      "familyId": "shoulder_press",
      "name": "Shoulder Press"
    },
    "squat": {
      "aliases": [],
      "familyId": "squat",
      "name": "Squat"
    },
    "triceps_extension": {
      "aliases": [
        "skull crusher",
        "pushdown"
      ],
      "familyId": "triceps_extension",
      "name": "Triceps Extension"
    }
  },
  "metadata": {
    "artifact": "exercise-relationships",
    "dimensionVocabulary": [
      "equipment",
      "grip",
      "stance",
      "angle",
      "laterality",
      "body_position",
      "load_position",
      "assistance",
      "resistance_type"
    ],
    "generator": "src/relationships/build.py",
    "projectRelease": "1.5.1",
    "relationshipVocabulary": [
      "member_of_family",
      "variation_of",
      "equipment_variant_of",
      "grip_variant_of",
      "stance_variant_of",
      "angle_variant_of",
      "laterality_variant_of"
    ],
    "semanticNotice": "Taxonomic/descriptive relationships do not imply physiological equivalence or substitution advice.",
    "sourceDatabaseSchemaVersion": "0.3.0",
    "sourceExerciseCount": 873,
    "sourceSha256": "d68a817484964095e6af0be2cdcbcc2c2504168d1d190c7d5c725ce52f3ae1f4"
  },
  "relationships": [
    {
      "confidence": "high",
      "dimensions": {
        "equipment": "barbell"
      },
      "familyId": "bench_press",
      "provenance": [
        {
          "rationale": "Curated taxonomic family assignment from reviewed DB++ metadata.",
          "source": "src/relationships/overrides.py",
          "type": "manual_review"
        }
      ],
      "relationship": "member_of_family",
      "sourceExerciseId": "Barbell_Bench_Press_-_Medium_Grip"
    },
    {
      "confidence": "high",
      "dimensions": {
        "equipment": "barbell"
      },
      "familyId": "bench_press",
      "provenance": [
        {
          "rationale": "Curated taxonomic family assignment from reviewed DB++ metadata.",
          "source": "src/relationships/build.py",
          "type": "rule"
        }
      ],
      "relationship": "member_of_family",
      "sourceExerciseId": "Barbell_Guillotine_Bench_Press"
    },
    {
      "confidence": "high",
      "dimensions": {
        "angle": "incline",
        "equipment": "barbell"
      },
      "familyId": "bench_press",
      "provenance": [
        {
          "rationale": "Curated taxonomic family assignment from reviewed DB++ metadata.",
          "source": "src/relationships/build.py",
          "type": "rule"
        }
      ],
      "relationship": "member_of_family",
      "sourceExerciseId": "Barbell_Incline_Bench_Press_-_Medium_Grip"
    },
    {
      "confidence": "high",
      "dimensions": {
        "equipment": "barbell"
      },
      "familyId": "bench_press",
      "provenance": [
        {
          "rationale": "Curated taxonomic family assignment from reviewed DB++ metadata.",
          "source": "src/relationships/build.py",
          "type": "rule"
        }
      ],
      "relationship": "member_of_family",
      "sourceExerciseId": "Bench_Press_-_Powerlifting"
    },
    {
      "confidence": "high",
      "dimensions": {
        "equipment": "bands",
        "resistance_type": "bands"
      },
      "familyId": "bench_press",
      "provenance": [
        {
          "rationale": "Curated taxonomic family assignment from reviewed DB++ metadata.",
          "source": "src/relationships/build.py",
          "type": "rule"
        }
      ],
      "relationship": "member_of_family",
      "sourceExerciseId": "Bench_Press_-_With_Bands"
    },
    {
      "confidence": "high",
      "dimensions": {
        "equipment": "barbell",
        "resistance_type": "chains"
      },
      "familyId": "bench_press",
      "provenance": [
        {
          "rationale": "Curated taxonomic family assignment from reviewed DB++ metadata.",
          "source": "src/relationships/build.py",
          "type": "rule"
        }
      ],
      "relationship": "member_of_family",
      "sourceExerciseId": "Bench_Press_with_Chains"
    },
    {
      "confidence": "high",
      "dimensions": {
        "equipment": "barbell",
        "grip": "close"
      },
      "familyId": "bench_press",
      "provenance": [
        {
          "rationale": "Curated taxonomic family assignment from reviewed DB++ metadata.",
          "source": "src/relationships/build.py",
          "type": "rule"
        }
      ],
      "relationship": "member_of_family",
      "sourceExerciseId": "Close-Grip_Barbell_Bench_Press"
    },
    {
      "confidence": "high",
      "dimensions": {
        "angle": "decline",
        "equipment": "barbell"
      },
      "familyId": "bench_press",
      "provenance": [
        {
          "rationale": "Curated taxonomic family assignment from reviewed DB++ metadata.",
          "source": "src/relationships/build.py",
          "type": "rule"
        }
      ],
      "relationship": "member_of_family",
      "sourceExerciseId": "Decline_Barbell_Bench_Press"
    },
    {
      "confidence": "high",
      "dimensions": {
        "angle": "decline",
        "equipment": "dumbbell"
      },
      "familyId": "bench_press",
      "provenance": [
        {
          "rationale": "Curated taxonomic family assignment from reviewed DB++ metadata.",
          "source": "src/relationships/build.py",
          "type": "rule"
        }
      ],
      "relationship": "member_of_family",
      "sourceExerciseId": "Decline_Dumbbell_Bench_Press"
    },
    {
      "confidence": "high",
      "dimensions": {
        "equipment": "dumbbell"
      },
      "familyId": "bench_press",
      "provenance": [
        {
          "rationale": "Curated taxonomic family assignment from reviewed DB++ metadata.",
          "source": "src/relationships/overrides.py",
          "type": "manual_review"
        }
      ],
      "relationship": "member_of_family",
      "sourceExerciseId": "Dumbbell_Bench_Press"
    },
    {
      "confidence": "high",
      "dimensions": {
        "equipment": "dumbbell",
        "grip": "neutral"
      },
      "familyId": "bench_press",
      "provenance": [
        {
          "rationale": "Curated taxonomic family assignment from reviewed DB++ metadata.",
          "source": "src/relationships/build.py",
          "type": "rule"
        }
      ],
      "relationship": "member_of_family",
      "sourceExerciseId": "Dumbbell_Bench_Press_with_Neutral_Grip"
    },
    {
      "confidence": "high",
      "dimensions": {
        "angle": "incline",
        "equipment": "dumbbell",
        "grip": "neutral"
      },
      "familyId": "bench_press",
      "provenance": [
        {
          "rationale": "Curated taxonomic family assignment from reviewed DB++ metadata.",
          "source": "src/relationships/build.py",
          "type": "rule"
        }
      ],
      "relationship": "member_of_family",
      "sourceExerciseId": "Hammer_Grip_Incline_DB_Bench_Press"
    },
    {
      "confidence": "high",
      "dimensions": {
        "equipment": "machine"
      },
      "familyId": "bench_press",
      "provenance": [
        {
          "rationale": "Curated taxonomic family assignment from reviewed DB++ metadata.",
          "source": "src/relationships/build.py",
          "type": "rule"
        }
      ],
      "relationship": "member_of_family",
      "sourceExerciseId": "Machine_Bench_Press"
    },
    {
      "confidence": "high",
      "dimensions": {
        "equipment": "dumbbell",
        "laterality": "unilateral"
      },
      "familyId": "bench_press",
      "provenance": [
        {
          "rationale": "Curated taxonomic family assignment from reviewed DB++ metadata.",
          "source": "src/relationships/build.py",
          "type": "rule"
        }
      ],
      "relationship": "member_of_family",
      "sourceExerciseId": "One_Arm_Dumbbell_Bench_Press"
    },
    {
      "confidence": "high",
      "dimensions": {
        "assistance": "reverse_band",
        "equipment": "barbell",
        "resistance_type": "bands"
      },
      "familyId": "bench_press",
      "provenance": [
        {
          "rationale": "Curated taxonomic family assignment from reviewed DB++ metadata.",
          "source": "src/relationships/build.py",